Gamers Now Watch More Than They Play — How Publishers Can Reclaim Lost Revenue: Report,N/A,17.039056039366212
"Cathie Wood-Led Ark's Prediction: AI Will Turn Digital Wallets Into $9 Trillion E-Commerce Powerhouses — Google, Amazon Dominance Set For Disruption?",N/A,17.039056039366212
Amazon's AWS CEO Teases Major AI Advancements,short-sell,17.039056039366212
"Hottest Free iPhone Apps In America Right Now: Block Blast, Threads, And ChatGPT Lead The Pack",short-sell,17.039056039366212
"Tech Stocks Set For Strong Santa Rally As Wall Street Looks For An End To 'Regulatory Spider Web' In The Trump Era, Says Dan Ives",buy,17.039056039366212
"Apple Partnership, AI Agents, And Major Infrastructure Investments: OpenAI Executives Outline Strategy To Attract 1B Users By 2025",buy,17.039056039366212
Esports Market Set To Surpass $5 Billion By 2029: What Investors Need To Know,buy,17.039056039366212What's Going On With Magnificent 7 Stocks?,short-sell,17.039056039366212
Amazon Stock Moves Higher As AWS Unveils New AI Advancements: What You Need To Know,short-sell,17.039056039366212
Apple's Multi-Year iPhone Cycle And App Store Dynamics Are Growth Catalysts: Analyst,short-sell,17.039056039366212
10 Information Technology Stocks Whale Activity In Today's Session,short-sell,17.039056039366212
Apple Executive Says Apple Plans To Use AWS Trainum Chips,short-sell,17.039056039366212
"Lack Of Sellers In The Stock Market, China Retaliates Against U.S.",short-sell,17.039056039366212
Apple Might Have To Commit $1 Billion To Indonesia To Reverse iPhone 16 Ban,short-sell,17.039056039366212
"Investigating Apple's Standing In Technology Hardware, Storage &amp; Peripherals Industry Compared To Competitors",buy,17.039056039366212
Taiwan Semi Supplier ASML Reiterates Outlook As Biden's Latest Semiconductor Embargo On China Kicks In,short-sell,17.039056039366212
"Ray Dalio's Bridgewater Adds Broadcom, Apple, SMCI In Q3, While Offloading Stake In AI Giant Nvidia And Other Big Tech Companies",short-sell,17.039056039366212
What's Going On With Magnificent 7 Stocks?,short-sell,17.039056039366212
Apple Might Have To Commit $1 Billion To Indonesia To Reverse iPhone 16 Ban,short-sell,17.039056039366212
"Ray Dalio's Bridgewater Adds Broadcom, Apple, SMCI In Q3, While Offloading Stake In AI Giant Nvidia And Other Big Tech Companies",short-sell,17.039056039366212
US Stocks Likely To Open Higher As Investors Gear Up For A Historically Strong Month: Wells Fargo Strategists See Trump Policies Setting A Backdrop Where 'Equities Continue To Rally',buy,17.039056039366212
AAPL Stock Hits New High Despite Sales Slowdown: Tech Bull Says 'Street Is Realizing' iPhone 16 Marks The 'Start Of A Super Cycle' For Apple,buy,17.039056039366212
Apple HomePod Could Be Delayed Until 2025: Top Analyst Predicts The Device Will Play Key Part In iPhone Maker's 'Smart Home Strategy',buy,17.039056039366212
S&P 500 Hits Another High As Apple Tops $242 For The First Time: Fear Index Remains In 'Greed' Zone,short-sell,17.039056039366212
Apple HomePod Could Be Delayed Until 2025: Top Analyst Predicts The Device Will Play Key Part In iPhone Maker's 'Smart Home Strategy',short-sell,17.039056039366212
Google's Veo Video Generator Arrives On Cloud: How Oreo Maker Mondelez Is Using AI For Creative Content,short-sell,17.039056039366212
